id,submitter,authors,title,comments,journal-ref,doi,report-no,categories,license,abstract,versions,update_date,authors_parsed,index_id
0704.0001,Pavel Nadolsky,"C. Bal\'azs, E. L. Berger, P. M. Nadolsky, C.-P. Yuan","Calculation of prompt diphoton production cross sections at Tevatron and
  LHC energies","37 pages, 15 figures; published version","Phys.Rev.D76:013009,2007",10.1103/PhysRevD.76.013009,ANL-HEP-PR-07-12,hep-ph,,"  A fully differential calculation in perturbative quantum chromodynamics is
presented for the production of massive photon pairs at hadron colliders. All
next-to-leading order perturbative contributions from quark-antiquark,
gluon-(anti)quark, and gluon-gluon subprocesses are included, as well as
all-orders resummation of initial-state gluon radiation valid at
next-to-next-to-leading logarithmic accuracy. The region of phase space is
specified in which the calculation is most reliable. Good agreement is
demonstrated with data from the Fermilab Tevatron, and predictions are made for
more detailed tests with CDF and DO data. Predictions are shown for
distributions of diphoton pairs produced at the energy of the Large Hadron
Collider (LHC). Distributions of the diphoton pairs from the decay of a Higgs
boson are contrasted with those produced from QCD processes at the LHC, showing
that enhanced sensitivity to the signal can be obtained with judicious
selection of events.
","[{'version': 'v1', 'created': 'Mon, 2 Apr 2007 19:18:42 GMT'}, {'version': 'v2', 'created': 'Tue, 24 Jul 2007 20:10:27 GMT'}]",2008-11-26,"[['Balázs', 'C.', ''], ['Berger', 'E. L.', ''], ['Nadolsky', 'P. M.', ''], ['Yuan', 'C. -P.', '']]",0
0704.0002,Louis Theran,Ileana Streinu and Louis Theran,Sparsity-certifying Graph Decompositions,To appear in Graphs and Combinatorics,,,,math.CO cs.CG,http://arxiv.org/licenses/nonexclusive-distrib/1.0/,"  We describe a new algorithm, the $(k,\ell)$-pebble game with colors, and use
it obtain a characterization of the family of $(k,\ell)$-sparse graphs and
algorithmic solutions to a family of problems concerning tree decompositions of
graphs. Special instances of sparse graphs appear in rigidity theory and have
received increased attention in recent years. In particular, our colored
pebbles generalize and strengthen the previous results of Lee and Streinu and
give a new proof of the Tutte-Nash-Williams characterization of arboricity. We
also present a new decomposition that certifies sparsity based on the
$(k,\ell)$-pebble game with colors. Our work also exposes connections between
pebble game algorithms and previous sparse graph algorithms by Gabow, Gabow and
Westermann and Hendrickson.
","[{'version': 'v1', 'created': 'Sat, 31 Mar 2007 02:26:18 GMT'}, {'version': 'v2', 'created': 'Sat, 13 Dec 2008 17:26:00 GMT'}]",2008-12-13,"[['Streinu', 'Ileana', ''], ['Theran', 'Louis', '']]",1
0704.0003,Hongjun Pan,Hongjun Pan,"The evolution of the Earth-Moon system based on the dark matter field
  fluid model","23 pages, 3 figures",,,,physics.gen-ph,,"  The evolution of Earth-Moon system is described by the dark matter field
fluid model proposed in the Meeting of Division of Particle and Field 2004,
American Physical Society. The current behavior of the Earth-Moon system agrees
with this model very well and the general pattern of the evolution of the
Moon-Earth system described by this model agrees with geological and fossil
evidence. The closest distance of the Moon to Earth was about 259000 km at 4.5
billion years ago, which is far beyond the Roche's limit. The result suggests
that the tidal friction may not be the primary cause for the evolution of the
Earth-Moon system. The average dark matter field fluid constant derived from
Earth-Moon system data is 4.39 x 10^(-22) s^(-1)m^(-1). This model predicts
that the Mars's rotation is also slowing with the angular acceleration rate
about -4.38 x 10^(-22) rad s^(-2).
","[{'version': 'v1', 'created': 'Sun, 1 Apr 2007 20:46:54 GMT'}, {'version': 'v2', 'created': 'Sat, 8 Dec 2007 23:47:24 GMT'}, {'version': 'v3', 'created': 'Sun, 13 Jan 2008 00:36:28 GMT'}]",2008-01-13,"[['Pan', 'Hongjun', '']]",2
0704.0004,David Callan,David Callan,"A determinant of Stirling cycle numbers counts unlabeled acyclic
  single-source automata",11 pages,,,,math.CO,,"  We show that a determinant of Stirling cycle numbers counts unlabeled acyclic
single-source automata. The proof involves a bijection from these automata to
certain marked lattice paths and a sign-reversing involution to evaluate the
determinant.
","[{'version': 'v1', 'created': 'Sat, 31 Mar 2007 03:16:14 GMT'}]",2007-05-23,"[['Callan', 'David', '']]",3
0704.0005,Alberto Torchinsky,Wael Abu-Shammala and Alberto Torchinsky,From dyadic $\Lambda_{\alpha}$ to $\Lambda_{\alpha}$,,"Illinois J. Math. 52 (2008) no.2, 681-689",,,math.CA math.FA,,"  In this paper we show how to compute the $\Lambda_{\alpha}$ norm, $\alpha\ge
0$, using the dyadic grid. This result is a consequence of the description of
the Hardy spaces $H^p(R^N)$ in terms of dyadic and special atoms.
","[{'version': 'v1', 'created': 'Mon, 2 Apr 2007 18:09:58 GMT'}]",2013-10-15,"[['Abu-Shammala', 'Wael', ''], ['Torchinsky', 'Alberto', '']]",4
0704.0006,Yue Hin Pong,Y. H. Pong and C. K. Law,Bosonic characters of atomic Cooper pairs across resonance,"6 pages, 4 figures, accepted by PRA",,10.1103/PhysRevA.75.043613,,cond-mat.mes-hall,,"  We study the two-particle wave function of paired atoms in a Fermi gas with
tunable interaction strengths controlled by Feshbach resonance. The Cooper pair
wave function is examined for its bosonic characters, which is quantified by
the correction of Bose enhancement factor associated with the creation and
annihilation composite particle operators. An example is given for a
three-dimensional uniform gas. Two definitions of Cooper pair wave function are
examined. One of which is chosen to reflect the off-diagonal long range order
(ODLRO). Another one corresponds to a pair projection of a BCS state. On the
side with negative scattering length, we found that paired atoms described by
ODLRO are more bosonic than the pair projected definition. It is also found
that at $(k_F a)^{-1} \ge 1$, both definitions give similar results, where more
than 90% of the atoms occupy the corresponding molecular condensates.
","[{'version': 'v1', 'created': 'Sat, 31 Mar 2007 04:24:59 GMT'}]",2015-05-13,"[['Pong', 'Y. H.', ''], ['Law', 'C. K.', '']]",5
0704.0007,Alejandro Corichi,"Alejandro Corichi, Tatjana Vukasinac and Jose A. Zapata",Polymer Quantum Mechanics and its Continuum Limit,"16 pages, no figures. Typos corrected to match published version","Phys.Rev.D76:044016,2007",10.1103/PhysRevD.76.044016,IGPG-07/03-2,gr-qc,,"  A rather non-standard quantum representation of the canonical commutation
relations of quantum mechanics systems, known as the polymer representation has
gained some attention in recent years, due to its possible relation with Planck
scale physics. In particular, this approach has been followed in a symmetric
sector of loop quantum gravity known as loop quantum cosmology. Here we explore
different aspects of the relation between the ordinary Schroedinger theory and
the polymer description. The paper has two parts. In the first one, we derive
the polymer quantum mechanics starting from the ordinary Schroedinger theory
and show that the polymer description arises as an appropriate limit. In the
second part we consider the continuum limit of this theory, namely, the reverse
process in which one starts from the discrete theory and tries to recover back
the ordinary Schroedinger quantum mechanics. We consider several examples of
interest, including the harmonic oscillator, the free particle and a simple
cosmological model.
","[{'version': 'v1', 'created': 'Sat, 31 Mar 2007 04:27:22 GMT'}, {'version': 'v2', 'created': 'Wed, 22 Aug 2007 22:42:11 GMT'}]",2008-11-26,"[['Corichi', 'Alejandro', ''], ['Vukasinac', 'Tatjana', ''], ['Zapata', 'Jose A.', '']]",6
0704.0008,Damian Swift,Damian C. Swift,"Numerical solution of shock and ramp compression for general material
  properties",Minor corrections,"Journal of Applied Physics, vol 104, 073536 (2008)",10.1063/1.2975338,"LA-UR-07-2051, LLNL-JRNL-410358",cond-mat.mtrl-sci,http://arxiv.org/licenses/nonexclusive-distrib/1.0/,"  A general formulation was developed to represent material models for
applications in dynamic loading. Numerical methods were devised to calculate
response to shock and ramp compression, and ramp decompression, generalizing
previous solutions for scalar equations of state. The numerical methods were
found to be flexible and robust, and matched analytic results to a high
accuracy. The basic ramp and shock solution methods were coupled to solve for
composite deformation paths, such as shock-induced impacts, and shock
interactions with a planar interface between different materials. These
calculations capture much of the physics of typical material dynamics
experiments, without requiring spatially-resolving simulations. Example
calculations were made of loading histories in metals, illustrating the effects
of plastic work on the temperatures induced in quasi-isentropic and
shock-release experiments, and the effect of a phase transition.
","[{'version': 'v1', 'created': 'Sat, 31 Mar 2007 04:47:20 GMT'}, {'version': 'v2', 'created': 'Thu, 10 Apr 2008 08:42:28 GMT'}, {'version': 'v3', 'created': 'Tue, 1 Jul 2008 18:54:28 GMT'}]",2009-02-05,"[['Swift', 'Damian C.', '']]",7
0704.0009,Paul Harvey,"Paul Harvey, Bruno Merin, Tracy L. Huard, Luisa M. Rebull, Nicholas
  Chapman, Neal J. Evans II, Philip C. Myers","The Spitzer c2d Survey of Large, Nearby, Insterstellar Clouds. IX. The
  Serpens YSO Population As Observed With IRAC and MIPS",,"Astrophys.J.663:1149-1173,2007",10.1086/518646,,astro-ph,,"  We discuss the results from the combined IRAC and MIPS c2d Spitzer Legacy
observations of the Serpens star-forming region. In particular we present a set
of criteria for isolating bona fide young stellar objects, YSO's, from the
extensive background contamination by extra-galactic objects. We then discuss
the properties of the resulting high confidence set of YSO's. We find 235 such
objects in the 0.85 deg^2 field that was covered with both IRAC and MIPS. An
additional set of 51 lower confidence YSO's outside this area is identified
from the MIPS data combined with 2MASS photometry. We describe two sets of
results, color-color diagrams to compare our observed source properties with
those of theoretical models for star/disk/envelope systems and our own modeling
of the subset of our objects that appear to be star+disks. These objects
exhibit a very wide range of disk properties, from many that can be fit with
actively accreting disks to some with both passive disks and even possibly
debris disks. We find that the luminosity function of YSO's in Serpens extends
down to at least a few x .001 Lsun or lower for an assumed distance of 260 pc.
The lower limit may be set by our inability to distinguish YSO's from
extra-galactic sources more than by the lack of YSO's at very low luminosities.
A spatial clustering analysis shows that the nominally less-evolved YSO's are
more highly clustered than the later stages and that the background
extra-galactic population can be fit by the same two-point correlation function
as seen in other extra-galactic studies. We also present a table of matches
between several previous infrared and X-ray studies of the Serpens YSO
population and our Spitzer data set.
","[{'version': 'v1', 'created': 'Mon, 2 Apr 2007 19:41:34 GMT'}]",2010-03-18,"[['Harvey', 'Paul', ''], ['Merin', 'Bruno', ''], ['Huard', 'Tracy L.', ''], ['Rebull', 'Luisa M.', ''], ['Chapman', 'Nicholas', ''], ['Evans', 'Neal J.', 'II'], ['Myers', 'Philip C.', '']]",8
0704.0010,Sergei Ovchinnikov,Sergei Ovchinnikov,"Partial cubes: structures, characterizations, and constructions","36 pages, 17 figures",,,,math.CO,,"  Partial cubes are isometric subgraphs of hypercubes. Structures on a graph
defined by means of semicubes, and Djokovi\'{c}'s and Winkler's relations play
an important role in the theory of partial cubes. These structures are employed
in the paper to characterize bipartite graphs and partial cubes of arbitrary
dimension. New characterizations are established and new proofs of some known
results are given.
  The operations of Cartesian product and pasting, and expansion and
contraction processes are utilized in the paper to construct new partial cubes
from old ones. In particular, the isometric and lattice dimensions of finite
partial cubes obtained by means of these operations are calculated.
","[{'version': 'v1', 'created': 'Sat, 31 Mar 2007 05:10:16 GMT'}]",2007-05-23,"[['Ovchinnikov', 'Sergei', '']]",9
0704.0011,Clifton Cunningham,Clifton Cunningham and Lassina Dembele,"Computing genus 2 Hilbert-Siegel modular forms over $\Q(\sqrt{5})$ via
  the Jacquet-Langlands correspondence",14 pages; title changed; to appear in Experimental Mathematics,,,,math.NT math.AG,http://arxiv.org/licenses/nonexclusive-distrib/1.0/,"  In this paper we present an algorithm for computing Hecke eigensystems of
Hilbert-Siegel cusp forms over real quadratic fields of narrow class number
one. We give some illustrative examples using the quadratic field
$\Q(\sqrt{5})$. In those examples, we identify Hilbert-Siegel eigenforms that
are possible lifts from Hilbert eigenforms.
","[{'version': 'v1', 'created': 'Sat, 31 Mar 2007 05:32:49 GMT'}, {'version': 'v2', 'created': 'Tue, 19 Aug 2008 04:46:47 GMT'}, {'version': 'v3', 'created': 'Wed, 20 Aug 2008 13:15:09 GMT'}]",2008-08-20,"[['Cunningham', 'Clifton', ''], ['Dembele', 'Lassina', '']]",10
0704.0012,Dohoon Choi,Dohoon Choi,"Distribution of integral Fourier Coefficients of a Modular Form of Half
  Integral Weight Modulo Primes",,,,,math.NT,,"  Recently, Bruinier and Ono classified cusp forms $f(z) := \sum_{n=0}^{\infty}
a_f(n)q ^n \in S_{\lambda+1/2}(\Gamma_0(N),\chi)\cap \mathbb{Z}[[q]]$ that does
not satisfy a certain distribution property for modulo odd primes $p$. In this
paper, using Rankin-Cohen Bracket, we extend this result to modular forms of
half integral weight for primes $p \geq 5$. As applications of our main theorem
we derive distribution properties, for modulo primes $p\geq5$, of traces of
singular moduli and Hurwitz class number. We also study an analogue of Newman's
conjecture for overpartitions.
","[{'version': 'v1', 'created': 'Sat, 31 Mar 2007 05:48:51 GMT'}]",2007-05-23,"[['Choi', 'Dohoon', '']]",11
0704.0013,Dohoon Choi,Dohoon Choi and YoungJu Choie,"$p$-adic Limit of Weakly Holomorphic Modular Forms of Half Integral
  Weight",,,,,math.NT,,"  Serre obtained the p-adic limit of the integral Fourier coefficient of
modular forms on $SL_2(\mathbb{Z})$ for $p=2,3,5,7$. In this paper, we extend
the result of Serre to weakly holomorphic modular forms of half integral weight
on $\Gamma_{0}(4N)$ for $N=1,2,4$. A proof is based on linear relations among
Fourier coefficients of modular forms of half integral weight. As applications
we obtain congruences of Borcherds exponents, congruences of quotient of
Eisentein series and congruences of values of $L$-functions at a certain point
are also studied. Furthermore, the congruences of the Fourier coefficients of
Siegel modular forms on Maass Space are obtained using Ikeda lifting.
","[{'version': 'v1', 'created': 'Sat, 31 Mar 2007 06:21:49 GMT'}, {'version': 'v2', 'created': 'Mon, 26 May 2008 03:31:52 GMT'}]",2008-05-26,"[['Choi', 'Dohoon', ''], ['Choie', 'YoungJu', '']]",12
0704.0014,Koichi Fujii,Koichi Fujii,Iterated integral and the loop product,"18 pages, 1 figure",,,,math.CA math.AT,,"  In this article we discuss a relation between the string topology and
differential forms based on the theory of Chen's iterated integrals and the
cyclic bar complex.
","[{'version': 'v1', 'created': 'Sun, 1 Apr 2007 12:04:13 GMT'}]",2009-09-29,"[['Fujii', 'Koichi', '']]",13
0704.0015,Christian Stahn,Christian Stahn,Fermionic superstring loop amplitudes in the pure spinor formalism,"22 pages; signs and coefficients adjusted for anticommuting
  superfields, section 4.3 changed accordingly, reference added","JHEP 0705:034,2007",10.1088/1126-6708/2007/05/034,,hep-th,,"  The pure spinor formulation of the ten-dimensional superstring leads to
manifestly supersymmetric loop amplitudes, expressed as integrals in pure
spinor superspace. This paper explores different methods to evaluate these
integrals and then uses them to calculate the kinematic factors of the one-loop
and two-loop massless four-point amplitudes involving two and four Ramond
states.
","[{'version': 'v1', 'created': 'Mon, 2 Apr 2007 18:10:09 GMT'}, {'version': 'v2', 'created': 'Mon, 10 Mar 2008 04:18:38 GMT'}]",2009-11-13,"[['Stahn', 'Christian', '']]",14
0704.0016,Li Tong,"Chao-Hsi Chang, Tong Li, Xue-Qian Li and Yu-Ming Wang",Lifetime of doubly charmed baryons,"17 pages, 3 figures and 1 table","Commun.Theor.Phys.49:993-1000,2008",10.1088/0253-6102/49/4/38,,hep-ph,,"  In this work, we evaluate the lifetimes of the doubly charmed baryons
$\Xi_{cc}^{+}$, $\Xi_{cc}^{++}$ and $\Omega_{cc}^{+}$. We carefully calculate
the non-spectator contributions at the quark level where the Cabibbo-suppressed
diagrams are also included. The hadronic matrix elements are evaluated in the
simple non-relativistic harmonic oscillator model. Our numerical results are
generally consistent with that obtained by other authors who used the diquark
model. However, all the theoretical predictions on the lifetimes are one order
larger than the upper limit set by the recent SELEX measurement. This
discrepancy would be clarified by the future experiment, if more accurate
experiment still confirms the value of the SELEX collaboration, there must be
some unknown mechanism to be explored.
","[{'version': 'v1', 'created': 'Sat, 31 Mar 2007 07:04:26 GMT'}]",2008-12-18,"[['Chang', 'Chao-Hsi', ''], ['Li', 'Tong', ''], ['Li', 'Xue-Qian', ''], ['Wang', 'Yu-Ming', '']]",15
0704.0017,Nceba Mhlahlo,"Nceba Mhlahlo, David H. Buckley, Vikram S. Dhillon, Steven B. Potter,
  Brian Warner and Patric A. Woudt","Spectroscopic Observations of the Intermediate Polar EX Hydrae in
  Quiescence","10 pages, 11 figures (figures 3, 4, 7 and 8 at reduced resolution,
  originals available on request). Accepted for publication in Monthly Notices
  of the Royal Astronomical Society","Mon.Not.Roy.Astron.Soc.378:211-220,2007",10.1111/j.1365-2966.2007.11762.x,,astro-ph,,"  Results from spectroscopic observations of the Intermediate Polar (IP) EX Hya
in quiescence during 1991 and 2001 are presented. Spin-modulated radial
velocities consistent with an outer disc origin were detected for the first
time in an IP. The spin pulsation was modulated with velocities near ~500-600
km/s. These velocities are consistent with those of material circulating at the
outer edge of the accretion disc, suggesting corotation of the accretion
curtain with material near the Roche lobe radius. Furthermore, spin Doppler
tomograms have revealed evidence of the accretion curtain emission extending
from velocities of ~500 km/s to ~1000 km/s. These findings have confirmed the
theoretical model predictions of King & Wynn (1999), Belle et al. (2002) and
Norton et al. (2004) for EX Hya, which predict large accretion curtains that
extend to a distance close to the Roche lobe radius in this system. Evidence
for overflow stream of material falling onto the magnetosphere was observed,
confirming the result of Belle et al. (2005) that disc overflow in EX Hya is
present during quiescence as well as outburst. It appears that the hbeta and
hgamma spin radial velocities originated from the rotation of the funnel at the
outer disc edge, while those of halpha were produced due to the flow of
material along the field lines far from the white dwarf (narrow component) and
close to the white dwarf (broad-base component), in agreement with the
accretion curtain model.
","[{'version': 'v1', 'created': 'Sat, 31 Mar 2007 07:38:48 GMT'}]",2009-06-23,"[['Mhlahlo', 'Nceba', ''], ['Buckley', 'David H.', ''], ['Dhillon', 'Vikram S.', ''], ['Potter', 'Steven B.', ''], ['Warner', 'Brian', ''], ['Woudt', 'Patric A.', '']]",16
0704.0018,Andreas Gustavsson,Andreas Gustavsson,In quest of a generalized Callias index theorem,"20 pages, v2: an overall sign and typos corrected",,,,hep-th,,"  We give a prescription for how to compute the Callias index, using as
regulator an exponential function. We find agreement with old results in all
odd dimensions. We show that the problem of computing the dimension of the
moduli space of self-dual strings can be formulated as an index problem in
even-dimensional (loop-)space. We think that the regulator used in this Letter
can be applied to this index problem.
","[{'version': 'v1', 'created': 'Mon, 2 Apr 2007 08:58:27 GMT'}, {'version': 'v2', 'created': 'Sat, 21 Apr 2007 17:16:20 GMT'}]",2007-05-23,"[['Gustavsson', 'Andreas', '']]",17
0704.0019,Norio Konno,Norio Konno,"Approximation for extinction probability of the contact process based on
  the Gr\""obner basis","6 pages, Journal-ref added","RIMS Kokyuroku, No.1551, pp.57-62 (2007)",,,math.PR math.AG,,"  In this note we give a new method for getting a series of approximations for
the extinction probability of the one-dimensional contact process by using the
Gr\""obner basis.
","[{'version': 'v1', 'created': 'Sat, 31 Mar 2007 08:12:35 GMT'}, {'version': 'v2', 'created': 'Sat, 23 Jun 2007 19:58:14 GMT'}]",2007-06-23,"[['Konno', 'Norio', '']]",18
0704.0020,Patrick Roudeau,"The BABAR Collaboration, B. Aubert, et al",Measurement of the Hadronic Form Factor in D0 --> K- e+ nue Decays,"21 pages, 13 postscript figures, submitted to Phys. Rev. D,
  contributed to 42nd Rencontres de Moriond: QCD and Hadronic Interactions","Phys.Rev.D76:052005,2007",10.1103/PhysRevD.76.052005,"BABAR-PUB-07/015, SLAC-PUB-12417",hep-ex,,"  The shape of the hadronic form factor f+(q2) in the decay D0 --> K- e+ nue
has been measured in a model independent analysis and compared with theoretical
calculations. We use 75 fb(-1) of data recorded by the BABAR detector at the
PEPII electron-positron collider. The corresponding decay branching fraction,
relative to the decay D0 --> K- pi+, has also been measured to be RD = BR(D0
--> K- e+ nue)/BR(D0 --> K- pi+) = 0.927 +/- 0.007 +/- 0.012. From these
results, and using the present world average value for BR(D0 --> K- pi+), the
normalization of the form factor at q2=0 is determined to be f+(0)=0.727 +/-
0.007 +/- 0.005 +/- 0.007 where the uncertainties are statistical, systematic,
and from external inputs, respectively.
","[{'version': 'v1', 'created': 'Sat, 31 Mar 2007 09:49:10 GMT'}]",2015-06-30,"[['The BABAR Collaboration', '', ''], ['Aubert', 'B.', '']]",19
0704.0021,Yuichi Togashi,"Vanessa Casagrande, Yuichi Togashi, Alexander S. Mikhailov","Molecular Synchronization Waves in Arrays of Allosterically Regulated
  Enzymes","5 pages, 4 figures","Phys. Rev. Lett. 99, 048301 (2007)",10.1103/PhysRevLett.99.048301,,nlin.PS physics.chem-ph q-bio.MN,,"  Spatiotemporal pattern formation in a product-activated enzymic reaction at
high enzyme concentrations is investigated. Stochastic simulations show that
catalytic turnover cycles of individual enzymes can become coherent and that
complex wave patterns of molecular synchronization can develop. The analysis
based on the mean-field approximation indicates that the observed patterns
result from the presence of Hopf and wave bifurcations in the considered
system.
","[{'version': 'v1', 'created': 'Sat, 31 Mar 2007 12:57:59 GMT'}, {'version': 'v2', 'created': 'Tue, 24 Jul 2007 04:01:20 GMT'}]",2007-07-24,"[['Casagrande', 'Vanessa', ''], ['Togashi', 'Yuichi', ''], ['Mikhailov', 'Alexander S.', '']]",20
0704.0022,Simon Malham,Simon J.A. Malham and Anke Wiese,Stochastic Lie group integrators,"20 pages, 4 figures",,,,math.NA,,"  We present Lie group integrators for nonlinear stochastic differential
equations with non-commutative vector fields whose solution evolves on a smooth
finite dimensional manifold. Given a Lie group action that generates transport
along the manifold, we pull back the stochastic flow on the manifold to the Lie
group via the action, and subsequently pull back the flow to the corresponding
Lie algebra via the exponential map. We construct an approximation to the
stochastic flow in the Lie algebra via closed operations and then push back to
the Lie group and then to the manifold, thus ensuring our approximation lies in
the manifold. We call such schemes stochastic Munthe-Kaas methods after their
deterministic counterparts. We also present stochastic Lie group integration
schemes based on Castell--Gaines methods. These involve using an underlying
ordinary differential integrator to approximate the flow generated by a
truncated stochastic exponential Lie series. They become stochastic Lie group
integrator schemes if we use Munthe-Kaas methods as the underlying ordinary
differential integrator. Further, we show that some Castell--Gaines methods are
uniformly more accurate than the corresponding stochastic Taylor schemes.
Lastly we demonstrate our methods by simulating the dynamics of a free rigid
body such as a satellite and an autonomous underwater vehicle both perturbed by
two independent multiplicative stochastic noise processes.
","[{'version': 'v1', 'created': 'Sat, 31 Mar 2007 11:05:53 GMT'}, {'version': 'v2', 'created': 'Tue, 16 Oct 2007 10:30:55 GMT'}]",2007-10-16,"[['Malham', 'Simon J. A.', ''], ['Wiese', 'Anke', '']]",21
