id,submitter,authors,title,comments,journal-ref,doi,report-no,categories,license,abstract,versions,update_date,authors_parsed,index_id
0704.0042,Ignazio Licata,Ignazio Licata,"General System theory, Like-Quantum Semantics and Fuzzy Sets","12 pages,3 figures",,,"Published in Systemics of Emergence. Research and Development,
  Minati G., Pessa E., Abram M., Springer, 2006, pages 723-734",physics.gen-ph quant-ph,,"  It is outlined the possibility to extend the quantum formalism in relation to
the requirements of the general systems theory. It can be done by using a
quantum semantics arising from the deep logical structure of quantum theory. It
is so possible taking into account the logical openness relationship between
observer and system. We are going to show how considering the truth-values of
quantum propositions within the context of the fuzzy sets is here more useful
for systemics . In conclusion we propose an example of formal quantum
coherence.
","[{'version': 'v1', 'created': 'Sat, 31 Mar 2007 17:28:35 GMT'}]",2010-04-26,"[['Licata', 'Ignazio', '']]",41
0704.0043,Alexander Gorban,"R.A. Brownlee, A.N. Gorban, J. Levesley",Nonequilibrium entropy limiters in lattice Boltzmann methods,"30 pages, 9 figures, 1 table","Physica A, V. 387, Issues 2-3 (2008), Pages 385-406",10.1016/j.physa.2007.09.031,,cond-mat.stat-mech cond-mat.mtrl-sci,,"  We construct a system of nonequilibrium entropy limiters for the lattice
Boltzmann methods (LBM). These limiters erase spurious oscillations without
blurring of shocks, and do not affect smooth solutions. In general, they do the
same work for LBM as flux limiters do for finite differences, finite volumes
and finite elements methods, but for LBM the main idea behind the construction
of nonequilibrium entropy limiter schemes is to transform a field of a scalar
quantity - nonequilibrium entropy. There are two families of limiters: (i)
based on restriction of nonequilibrium entropy (entropy ""trimming"") and (ii)
based on filtering of nonequilibrium entropy (entropy filtering). The physical
properties of LBM provide some additional benefits: the control of entropy
production and accurate estimate of introduced artificial dissipation are
possible. The constructed limiters are tested on classical numerical examples:
1D athermal shock tubes with an initial density ratio 1:2 and the 2D lid-driven
cavity for Reynolds numbers Re between 2000 and 7500 on a coarse 100*100 grid.
All limiter constructions are applicable for both entropic and non-entropic
quasiequilibria.
","[{'version': 'v1', 'created': 'Sat, 31 Mar 2007 17:31:12 GMT'}]",2007-11-19,"[['Brownlee', 'R. A.', ''], ['Gorban', 'A. N.', ''], ['Levesley', 'J.', '']]",42
0704.0044,Alexander Schekochihin,"A. A. Schekochihin (Oxford), S. C. Cowley (Culham), W. Dorland
  (Maryland), G. W. Hammett (Princeton), G. G. Howes (Iowa), E. Quataert
  (Berkeley), T. Tatsuno (Maryland)","Astrophysical gyrokinetics: kinetic and fluid turbulent cascades in
  magnetized weakly collisional plasmas","aastex using emulateapj, 65 pages, 10 figures; replaced to match
  published version","ApJS 182, 310 (2009)",10.1088/0067-0049/182/1/310,,astro-ph nlin.CD physics.plasm-ph physics.space-ph,http://arxiv.org/licenses/nonexclusive-distrib/1.0/,"  We present a theoretical framework for plasma turbulence in astrophysical
plasmas (solar wind, interstellar medium, galaxy clusters, accretion disks).
The key assumptions are that the turbulence is anisotropic with respect to the
mean magnetic field and frequencies are low compared to the ion cyclotron
frequency. The energy injected at the outer scale scale has to be converted
into heat, which ultimately cannot be done without collisions. A KINETIC
CASCADE develops that brings the energy to collisional scales both in space and
velocity. Its nature depends on the physics of plasma fluctuations. In each of
the physically distinct scale ranges, the kinetic problem is systematically
reduced to a more tractable set of equations. In the ""inertial range"" above the
ion gyroscale, the kinetic cascade splits into a cascade of Alfvenic
fluctuations, which are governed by the RMHD equations at both the collisional
and collisionless scales, and a passive cascade of compressive fluctuations,
which obey a linear kinetic equation along the moving field lines associated
with the Alfvenic component. In the ""dissipation range"" between the ion and
electron gyroscales, there are again two cascades: the kinetic-Alfven-wave
(KAW) cascade governed by two fluid-like Electron RMHD equations and a passive
phase-space cascade of ion entropy fluctuations. The latter cascade brings the
energy of the inertial-range fluctuations that was damped by collisionless
wave-particle interaction at the ion gyroscale to collisional scales in the
phase space and leads to ion heating. The KAW energy is similarly damped at the
electron gyroscale and converted into electron heat. Kolmogorov-style scaling
relations are derived for these cascades. Astrophysical and space-physical
applications are discussed in detail.
","[{'version': 'v1', 'created': 'Sat, 31 Mar 2007 17:47:54 GMT'}, {'version': 'v2', 'created': 'Sat, 24 May 2008 19:38:45 GMT'}, {'version': 'v3', 'created': 'Sat, 24 Jan 2009 19:05:36 GMT'}, {'version': 'v4', 'created': 'Sat, 9 May 2009 19:26:10 GMT'}]",2015-05-13,"[['Schekochihin', 'A. A.', '', 'Oxford'], ['Cowley', 'S. C.', '', 'Culham'], ['Dorland', 'W.', '', 'Maryland'], ['Hammett', 'G. W.', '', 'Princeton'], ['Howes', 'G. G.', '', 'Iowa'], ['Quataert', 'E.', '', 'Berkeley'], ['Tatsuno', 'T.', '', 'Maryland']]",43
0704.0045,A. M. Kamchatnov,"G.A. El, R.H.J. Grimshaw, A.M. Kamchatnov","Evolution of solitary waves and undular bores in shallow-water flows
  over a gradual slope with bottom friction",accepted for publication in J. Fluid Mech.,"J. Fluid Mech. 585, 213-244 (2007)",10.1017/S0022112007006817,,nlin.PS nlin.SI,,"  This paper considers the propagation of shallow-water solitary and nonlinear
periodic waves over a gradual slope with bottom friction in the framework of a
variable-coefficient Korteweg-de Vries equation. We use the Whitham averaging
method, using a recent development of this theory for perturbed integrable
equations. This general approach enables us not only to improve known results
on the adiabatic evolution of isolated solitary waves and periodic wave trains
in the presence of variable topography and bottom friction, modeled by the
Chezy law, but also importantly, to study the effects of these factors on the
propagation of undular bores, which are essentially unsteady in the system
under consideration. In particular, it is shown that the combined action of
variable topography and bottom friction generally imposes certain global
restrictions on the undular bore propagation so that the evolution of the
leading solitary wave can be substantially different from that of an isolated
solitary wave with the same initial amplitude. This non-local effect is due to
nonlinear wave interactions within the undular bore and can lead to an
additional solitary wave amplitude growth, which cannot be predicted in the
framework of the traditional adiabatic approach to the propagation of solitary
waves in slowly varying media.
","[{'version': 'v1', 'created': 'Sat, 31 Mar 2007 18:09:02 GMT'}]",2007-09-23,"[['El', 'G. A.', ''], ['Grimshaw', 'R. H. J.', ''], ['Kamchatnov', 'A. M.', '']]",44
0704.0046,Denes Petz,"I. Csiszar, F. Hiai and D. Petz",A limit relation for entropy and channel capacity per unit cost,"LATEX file, 11 pages","J. Math. Phys. 48(2007), 092102.",10.1063/1.2779138,,quant-ph cs.IT math.IT,,"  In a quantum mechanical model, Diosi, Feldmann and Kosloff arrived at a
conjecture stating that the limit of the entropy of certain mixtures is the
relative entropy as system size goes to infinity. The conjecture is proven in
this paper for density matrices. The first proof is analytic and uses the
quantum law of large numbers. The second one clarifies the relation to channel
capacity per unit cost for classical-quantum channels. Both proofs lead to
generalization of the conjecture.
","[{'version': 'v1', 'created': 'Sun, 1 Apr 2007 16:37:36 GMT'}]",2009-11-13,"[['Csiszar', 'I.', ''], ['Hiai', 'F.', ''], ['Petz', 'D.', '']]",45
0704.0047,Igor Grabec,T. Kosel and I. Grabec,"Intelligent location of simultaneously active acoustic emission sources:
  Part I","5 pages, 5 eps figures, uses IEEEtran.cls",,,,cs.NE cs.AI,,"  The intelligent acoustic emission locator is described in Part I, while Part
II discusses blind source separation, time delay estimation and location of two
simultaneously active continuous acoustic emission sources.
  The location of acoustic emission on complicated aircraft frame structures is
a difficult problem of non-destructive testing. This article describes an
intelligent acoustic emission source locator. The intelligent locator comprises
a sensor antenna and a general regression neural network, which solves the
location problem based on learning from examples. Locator performance was
tested on different test specimens. Tests have shown that the accuracy of
location depends on sound velocity and attenuation in the specimen, the
dimensions of the tested area, and the properties of stored data. The location
accuracy achieved by the intelligent locator is comparable to that obtained by
the conventional triangulation method, while the applicability of the
intelligent locator is more general since analysis of sonic ray paths is
avoided. This is a promising method for non-destructive testing of aircraft
frame structures by the acoustic emission method.
","[{'version': 'v1', 'created': 'Sun, 1 Apr 2007 13:06:50 GMT'}]",2009-09-29,"[['Kosel', 'T.', ''], ['Grabec', 'I.', '']]",46
0704.0048,Alexander Stroeer,"Alexander Stroeer, John Veitch, Christian Roever, Ed Bloomer, James
  Clark, Nelson Christensen, Martin Hendry, Chris Messenger, Renate Meyer,
  Matthew Pitkin, Jennifer Toher, Richard Umstaetter, Alberto Vecchio and
  Graham Woan","Inference on white dwarf binary systems using the first round Mock LISA
  Data Challenges data sets","GWDAW-11 proceeding, submitted to CQG, 10 pages, 3 figures, 1 table;
  revised values in table","Class.Quant.Grav.24:S541-S550,2007",10.1088/0264-9381/24/19/S17,,gr-qc astro-ph,,"  We report on the analysis of selected single source data sets from the first
round of the Mock LISA Data Challenges (MLDC) for white dwarf binaries. We
implemented an end-to-end pipeline consisting of a grid-based coherent
pre-processing unit for signal detection, and an automatic Markov Chain Monte
Carlo post-processing unit for signal evaluation. We demonstrate that signal
detection with our coherent approach is secure and accurate, and is increased
in accuracy and supplemented with additional information on the signal
parameters by our Markov Chain Monte Carlo approach. We also demonstrate that
the Markov Chain Monte Carlo routine is additionally able to determine
accurately the noise level in the frequency window of interest.
","[{'version': 'v1', 'created': 'Sat, 31 Mar 2007 19:17:47 GMT'}, {'version': 'v2', 'created': 'Tue, 3 Apr 2007 22:26:37 GMT'}]",2008-11-26,"[['Stroeer', 'Alexander', ''], ['Veitch', 'John', ''], ['Roever', 'Christian', ''], ['Bloomer', 'Ed', ''], ['Clark', 'James', ''], ['Christensen', 'Nelson', ''], ['Hendry', 'Martin', ''], ['Messenger', 'Chris', ''], ['Meyer', 'Renate', ''], ['Pitkin', 'Matthew', ''], ['Toher', 'Jennifer', ''], ['Umstaetter', 'Richard', ''], ['Vecchio', 'Alberto', ''], ['Woan', 'Graham', '']]",47
0704.0049,Mikkel {\O}bro,Mikkel {\O}bro,An algorithm for the classification of smooth Fano polytopes,17 pages.,,,,math.CO,,"  We present an algorithm that produces the classification list of smooth Fano
d-polytopes for any given d. The input of the algorithm is a single number,
namely the positive integer d. The algorithm has been used to classify smooth
Fano d-polytopes for d<=7. There are 7622 isomorphism classes of smooth Fano
6-polytopes and 72256 isomorphism classes of smooth Fano 7-polytopes.
","[{'version': 'v1', 'created': 'Mon, 2 Apr 2007 09:23:25 GMT'}]",2007-05-23,"[['Øbro', 'Mikkel', '']]",48
0704.0050,Igor Grabec,T. Kosel and I. Grabec,"Intelligent location of simultaneously active acoustic emission sources:
  Part II","5 pages, 7 eps figures, uses IEEEtran.cls",,,,cs.NE cs.AI,,"  Part I describes an intelligent acoustic emission locator, while Part II
discusses blind source separation, time delay estimation and location of two
continuous acoustic emission sources.
  Acoustic emission (AE) analysis is used for characterization and location of
developing defects in materials. AE sources often generate a mixture of various
statistically independent signals. A difficult problem of AE analysis is
separation and characterization of signal components when the signals from
various sources and the mode of mixing are unknown. Recently, blind source
separation (BSS) by independent component analysis (ICA) has been used to solve
these problems. The purpose of this paper is to demonstrate the applicability
of ICA to locate two independent simultaneously active acoustic emission
sources on an aluminum band specimen. The method is promising for
non-destructive testing of aircraft frame structures by acoustic emission
analysis.
","[{'version': 'v1', 'created': 'Sun, 1 Apr 2007 18:53:13 GMT'}]",2007-05-23,"[['Kosel', 'T.', ''], ['Grabec', 'I.', '']]",49
